B1: Monday | C1: Tuesday | D1: Wednesday | E1: Thursday | F1: Friday | G1: Saturday | H1: Sunday | J1: Notes
A2: 0 | E2: =D42 -> A Genre | F2: =E40 -> SciFi Original Movie | G2: =F42 -> Farscape (new) | H2: More Cartoons
A3: =A2+0.5*(1/24) -> 2.0833333333333332E-2 | E3: =D43 -> Anthology Show | F3: =E41 -> of the week | G3: =F43 -> | | H3: (Adult)
A4: =A3+0.5*(1/24) -> 4.1666666666666664E-2 | E4: =D44 -> ? | F4: =E42 -> | | G4: =F44 -> Doctor Who (new) | H4: =G44 -> |
A5: =A4+0.5*(1/24) -> 6.25E-2 | E5: =D45 -> ? | F5: =E43 -> | | G5: =F45 -> | | H5: =G45 -> |
A6: =A5+0.5*(1/24) -> 8.3333333333333329E-2 | E6: =D46 -> Threshold (new) | G6: =F46 -> Torchwood | H6: =G46 -> |
A7: =A6+0.5*(1/24) -> 0.10416666666666666 | E7: =D47 -> | | G7: =F47 -> | | H7: V
A8: =A7+0.5*(1/24) -> 0.125
A9: =A8+0.5*(1/24) -> 0.14583333333333331
A10: =A9+0.5*(1/24) -> 0.16666666666666666
A11: =A10+0.5*(1/24) -> 0.1875
A12: =A11+0.5*(1/24) -> 0.20833333333333334
A13: =A12+0.5*(1/24) -> 0.22916666666666669
A14: =A13+0.5*(1/24) -> 0.25
A15: =A14+0.5*(1/24) -> 0.27083333333333331
A16: =A15+0.5*(1/24) -> 0.29166666666666663
A17: =A16+0.5*(1/24) -> 0.3125
A18: =A17+0.5*(1/24) -> 0.33333333333333326 | B18: Star Trek Ent* | C18: Star Trek TOS* | D18: Star Trek TNG* | E18: Star Trek DS9* | F18: Star Trek Voyager* | G18: Star Trek TAS* | H18: Sunday
A19: =A18+0.5*(1/24) -> 0.35416666666666657 | B19: | | C19: | | D19: | | E19: | | F19: | | G19: D&D Cartoon** | H19: Movie
A20: =A19+0.5*(1/24) -> 0.375 | B20: | | C20: | | D20: | | E20: | | F20: | | G20: He-Man** | H20: Marathon
A21: =A20+0.5*(1/24) -> 0.3958333333333332 | B21: V | C21: V | D21: V | E21: V | F21: V | G21: Thundercats** | H21: (all movies
A22: =A21+0.5*(1/24) -> 0.41666666666666652 | B22: Daily Classic Movie | C22: Daily Classic Movie | D22: Daily Classic Movie | E22: Daily Classic Movie | F22: Daily Classic Movie | G22: SilverHawks** | H22: share a
A23: =A22+0.5*(1/24) -> 0.4375 | B23: (30+ Years old) | C23: (30+ Years old) | D23: (30+ Years old) | E23: (30+ Years old) | F23: (30+ Years old) | G23: Voltron** | H23: common
A24: =A23+0.5*(1/24) -> 0.45833333333333315 | B24: | | C24: | | D24: | | E24: | | F24: | | G24: The Batman** | H24: theme)
A25: =A24+0.5*(1/24) -> 0.47916666666666646 | B25: V | C25: V | D25: V | E25: V | F25: V | G25: Cartoon Block | H25: |
A26: =A25+0.5*(1/24) -> 0.5 | B26: Quantum Leap* | C26: ** | D26: SG1* | E26: ** | F26: Buffy / Angel* | G26: | | H26: |
A27: =A26+0.5*(1/24) -> 0.52083333333333315 | B27: | | C27: | | D27: | | E27: | | F27: (Run, interlaced as | G27: | | H27: |
A28: =A27+0.5*(1/24) -> 0.54166666666666652 | B28: | | C28: | | D28: | | E28: | | F28: needed) | G28: V | H28: |
A29: =A28+0.5*(1/24) -> 0.5625 | B29: V | C29: V | D29: V | E29: V | F29: V | G29: The Superman** | H29: |
A30: =A29+0.5*(1/24) -> 0.58333333333333326 | B30: Daily "New" Movie | C30: Daily "New" Movie | D30: Daily "New" Movie | E30: Daily "New" Movie | F30: Daily "New" Movie | G30: Cartoon Block | H30: |
A31: =A30+0.5*(1/24) -> 0.60416666666666663 | B31: (29- Years Old) | C31: (29- Years Old) | D31: (29- Years Old) | E31: (29- Years Old) | F31: (29- Years Old) | G31: | | H31: |
A32: =A31+0.5*(1/24) -> 0.625 | B32: | | C32: | | D32: | | E32: | | F32: | | G32: | | H32: |
A33: =A32+0.5*(1/24) -> 0.64583333333333337 | B33: V | C33: V | D33: V | E33: V | F33: V | G33: V | H33: |
A34: =A33+0.5*(1/24) -> 0.66666666666666674 | B34: Highlander* | C34: ** | D34: Xena / Hercules* | E34: ** | F34: Classic Doctor Who* | G34: Transformers** | H34: |
A35: =A34+0.5*(1/24) -> 0.6875 | B35: | | C35: | | D35: | | E35: | | F35: | | G35: GoBots** | H35: |
A36: =A35+0.5*(1/24) -> 0.70833333333333348 | B36: | | C36: | | D36: | | E36: | | F36: | | G36: Reboot** | H36: |
A37: =A36+0.5*(1/24) -> 0.72916666666666685 | B37: V | C37: V | D37: V | E37: V | F37: V | G37: Etc** | H37: |
A38: =A37+0.5*(1/24) -> 0.75 | B38: Some Cartoon** | C38: Unaired Pilots | D38: SciFi Oriented | E38: Some Cartoon** | F38: Week in Geek | G38: | | H38: | | J38: SciFi Oriented Comedy hour is geek humor whether is it replaying of Robot Chicken shorts or a continuous run of a scifi-related sitcom, whatever.
A39: =A38+0.5*(1/24) -> 0.77083333333333359 | B39: World News Update | C39: | | D39: Comedy Hour | E39: World News Update | F39: | | G39: | | H39: | | J39: World News Update is a summary of events and
A40: =A39+0.5*(1/24) -> 0.79166666666666696 | B40: Monday Movie Night | C40: Tuesday Torture Night | D40: ? | E40: SciFi Original Movie | F40: ? | G40: | | H40: | | J40: happeneings in world events. No fluff
A41: =A40+0.5*(1/24) -> 0.8125 | B41: | | C41: (bad movies) | D41: ? | E41: of the week | F41: ? | G41: | | H41: | | J41: No celebrity gossip
A42: =A41+0.5*(1/24) -> 0.8333333333333337 | B42: | | C42: | | D42: A Genre | E42: | | F42: Farscape (new) | G42: | | H42: | | J42: no human interest stories
A43: =A42+0.5*(1/24) -> 0.85416666666666707 | B43: | | C43: | | D43: Anthology Show | E43: | | F43: | | G43: | | H43: | | J43: Week in geek will be a news show that aggregates "real" news that is geek-relevant
A44: =A43+0.5*(1/24) -> 0.875 | B44: | | C44: | | D44: ? | E44: Brilliant Classic | F44: Doctor Who (new) | G44: | | H44: |
A45: =A44+0.5*(1/24) -> 0.89583333333333381 | B45: | | C45: | | D45: ? | E45: Movie of the Week | F45: | | G45: | | H45: V
A46: =A45+0.5*(1/24) -> 0.91666666666666718 | B46: | | C46: | | D46: Threshold (new) | E46: | | F46: Torchwood | G46: | | H46: Week in
A47: =A46+0.5*(1/24) -> 0.93750000000000056 | B47: V | C47: V | D47: | | E47: | | F47: | | G47: | | H47: Geek
A48: =A47+0.5*(1/24) -> 0.95833333333333393 | B48: Attack of the Show | C48: Attack of the Show | D48: Attack of the Show | E48: Attack of the Show | F48: Attack of the Show | G48: V
A49: =A48+0.5*(1/24) -> 0.9791666666666673 | B49: (for geek news) | C49: (for geek news) | D49: (for geek news) | E49: (for geek news) | F49: (for geek news) | G49: Futurama**
A51: * Indicates that the show cycles back on itself when it finishes its run (with the exception of Start Trek, a show needs 7 seasons to qualify)
A52: ** Indicates that the show is replaced with another show to run in order